<?xml version="1.0" encoding="UTF-8"?>

<!--
	Document   : catalog.xml
    Author     : RgB
    Description: the catalog itself
-->

<services xmlns:xsi="http://www.w3.org/2001/XMLSchema-instance"
          xsi:noNamespaceSchemaLocation="catalog.xsd">
    <globals>
        <base>http://ltw1001.web.cs.unibo.it/RgB/</base>
        <group>LTW01</group>
        <members>
            <member>Andrea Bagnacani</member>
            <member>Andrea Ginesi</member>
            <member>Federico Roffi</member>
        </members>
    </globals>

    <service>
        <name>Diff Ontologico</name>
        <description>Diff tra documenti TEI sulla base di una data ontologia</description>
        <URI>DiffOntologico</URI>
        <HTTPmethod>POST</HTTPmethod>
        <params>nessun parametro</params>
        <inputs>
            <input>text/xml</input>
            <input>application/octet-stream</input>
        </inputs>
        <outputs>
            <output>application/rdf+xml</output>
        </outputs>
    </service>

    <service>
        <name>Estrazione di concordanze</name>
        <description>Motore di ricerca per l'estrazione delle concordanze</description>
        <URI>EstrazioneDiConcordanze</URI>
        <HTTPmethod>POST</HTTPmethod>
        <params>
            <param name="word" type="string">la parola da ricercare</param>
            <param name="number" type="number">il numero di parole "di contesto" che si vogliono visualizzare prima e dopo la parola ricercata</param>
        </params>
        <inputs>
            <input>text/xml</input>
        </inputs>
        <outputs>
            <output>text/html</output>
        </outputs>
    </service>
    
    <service>
        <name>Stemma Codicum</name>
        <description>Visualizzazione dello Stemma Codicum di un documento</description>
        <URI>StemmaCodicum</URI>
        <HTTPmethod>POST</HTTPmethod>
        <params>nessun parametro</params>
        <inputs>
            <input>text/xml</input>
            <input>application/octet-stream</input>
        </inputs>
        <outputs>
            <output>image/svg+xml</output>
        </outputs>

    </service>
</services>
